{
  "$schema": "../../schemas/pack-metadata.schema.json",
  "id": "core-labs-hematology",
  "name": "Hematology Laboratory Panel",
  "version": "1.0.0",
  "description": "Complete blood count (CBC), iron studies, coagulation panel, and inflammatory markers",
  "author": "Lattice Health Foundation",
  "license": "CC-BY-4.0",
  "category": "labs",
  "tags": ["labs", "hematology", "cbc", "hemoglobin", "anemia", "coagulation", "iron"],
  "latticeMinVersion": "1.0.0",
  "fhirVersion": "R4",
  "variableCount": 28,
  "variables": [
    "loinc-718-7",
    "loinc-4544-3",
    "loinc-789-8",
    "loinc-6690-2",
    "loinc-777-3",
    "loinc-787-2",
    "loinc-785-6",
    "loinc-786-4",
    "loinc-788-0",
    "loinc-30384-2",
    "loinc-751-8",
    "loinc-731-0",
    "loinc-742-7",
    "loinc-711-2",
    "loinc-704-7",
    "loinc-17849-1",
    "loinc-2500-7",
    "loinc-14800-7",
    "loinc-2502-3",
    "loinc-35572-7",
    "loinc-5902-2",
    "loinc-5964-2",
    "loinc-6301-6",
    "loinc-3173-2",
    "loinc-30341-2",
    "loinc-1988-5",
    "loinc-4537-7",
    "loinc-71695-1"
  ],
  "dependsOn": []
}
