{
  "$schema": "../../schemas/pack-metadata.schema.json",
  "id": "core-labs-liver",
  "name": "Liver Laboratory Panel",
  "version": "1.0.0",
  "description": "Liver function tests including hepatocellular enzymes, cholestatic markers, synthetic function, and bilirubin fractions",
  "author": "Lattice Health Foundation",
  "license": "CC-BY-4.0",
  "category": "labs",
  "tags": ["labs", "liver", "hepatology", "lfts", "bilirubin", "enzymes", "hepatitis"],
  "latticeMinVersion": "1.0.0",
  "fhirVersion": "R4",
  "variableCount": 18,
  "variables": [
    "loinc-1920-8",
    "loinc-1742-6",
    "loinc-6768-6",
    "loinc-2324-2",
    "loinc-1975-2",
    "loinc-1968-7",
    "loinc-1971-1",
    "loinc-1751-7",
    "loinc-2885-2",
    "loinc-10834-0",
    "loinc-1841-9",
    "loinc-2532-0",
    "loinc-1825-2",
    "loinc-5905-5",
    "loinc-16935-9",
    "loinc-5196-1",
    "loinc-5195-3",
    "loinc-22664-7"
  ],
  "dependsOn": []
}
