{
  "$schema": "../../schemas/pack-metadata.schema.json",
  "id": "core-labs-renal",
  "name": "Renal Laboratory Panel",
  "version": "1.0.0",
  "description": "Laboratory variables for renal function assessment including creatinine, eGFR, BUN, electrolytes, and urinalysis markers",
  "author": "Lattice Health Foundation",
  "license": "CC-BY-4.0",
  "category": "labs",
  "tags": ["labs", "renal", "kidney", "ckd", "nephrology", "electrolytes", "egfr", "creatinine"],
  "latticeMinVersion": "1.0.0",
  "fhirVersion": "R4",
  "variableCount": 24,
  "variables": [
    "loinc-2160-0",
    "loinc-48642-3",
    "loinc-48643-1",
    "loinc-62238-1",
    "loinc-3094-0",
    "loinc-6299-2",
    "loinc-82810-3",
    "loinc-2951-2",
    "loinc-2823-3",
    "loinc-2075-0",
    "loinc-1963-8",
    "loinc-17861-6",
    "loinc-2777-1",
    "loinc-2601-3",
    "loinc-1751-7",
    "loinc-1920-8",
    "loinc-2965-2",
    "loinc-14959-1",
    "loinc-13705-9",
    "loinc-9318-7",
    "loinc-32294-1",
    "loinc-14958-3",
    "loinc-2889-4",
    "loinc-3097-3"
  ],
  "dependsOn": []
}
