{
  "$schema": "../../schemas/pack-metadata.schema.json",
  "id": "core-vitals",
  "name": "Core Vital Signs",
  "version": "1.0.0",
  "description": "Standard vital sign measurements with both metric and imperial unit variants for weight, height, and temperature",
  "author": "Lattice Health Foundation",
  "license": "CC-BY-4.0",
  "category": "vitals",
  "tags": ["vitals", "blood-pressure", "heart-rate", "temperature", "weight", "height", "bmi", "spo2"],
  "latticeMinVersion": "1.0.0",
  "fhirVersion": "R4",
  "variableCount": 18,
  "variables": [
    "loinc-8480-6",
    "loinc-8462-4",
    "loinc-8867-4",
    "loinc-9279-1",
    "loinc-8310-5",
    "loinc-8331-1",
    "loinc-29463-7",
    "loinc-3141-9",
    "loinc-8302-2",
    "loinc-8306-3",
    "loinc-39156-5",
    "loinc-2708-6",
    "loinc-59408-5",
    "local-pulse-regularity",
    "local-bp-position",
    "local-bp-arm",
    "local-weight-method",
    "local-vitals-notes"
  ],
  "dependsOn": []
}
